"Name","Title","Company","Platform","Email","Language","Niche","Outreach Angle","Category","Country"
"Canal+ Afrique","Direction des Acquisitions Content","ENTRY","Canal+ Africa","acquisitions.afrique@canal-plus.com","French","LIVE ACTION","Cross-continental appeal, multi-language action universe","CONTENT ACQUISITIONS","Ivory Coast"
"Canal+ Afrique Content","Direct Acquisitions Desk","MID","Canal+ Africa","canalafrique@contact.com","French/English","Live Action/Animation","Global South franchise with cross-media appeal for regional scaling","CONTENT ACQUISITIONS","Africa"
"Lynn Fourie","Completed Projects Submission Contact","SENIOR","MultiChoice / Canal+ Africa / M-Net","Lynn.Fourie@mnet.co.za","English","African TV/streaming completed projects","Public MultiChoice webinar route for completed-project consideration; verify current role before sending.","CONTENT ACQUISITIONS","South Africa"
"Gabriella Abrahamse","Channel O Music Specialist","MID","MultiChoice / Canal+ Africa / M-Net","Gabriella.Abrahamse@mnet.co.za","English","Music and video programming","Public MultiChoice webinar lists direct Channel O submission email; OST/music-video angle only.","CONTENT ACQUISITIONS","South Africa"
"Thando Mbatha","Mzansi Magic Music Specialist","MID","MultiChoice / Canal+ Africa / M-Net","Thando.Mbatha@mnet.co.za","English","Music and video programming","Public MultiChoice webinar lists direct MMM submission email; soundtrack/music-story angle only.","CONTENT ACQUISITIONS","South Africa"
"Canal+ Africa Submissions","","ENTRY","Canal+ Africa","content@canalplus.com","French","General","Official submissions for Canal+ Africa","CONTENT ACQUISITIONS","Africa"
"Canal+ Africa Content Manager","Content Manager","MID","Canal+ Africa","contentmanager@canalplus.com","French","General","Mid-level content management","CONTENT ACQUISITIONS","Africa"
