"Nome","Handle","Plataforma","Seguidores","Contato","Nicho","Angulo","Categoria","Pais"
"Fantasy Reading Lounge","@FantasyReadLounge","YOUTUBE","≈35K","fantasyreadlounge@gmail.com","English — Fantasy BookTube & Reading Vlogs","Low-friction reading challenge: completely free transmedia book saga","BOOKS","US"
"The Chronicle Corner","@ChronicleCorner","YOUTUBE","≈24K","chroniclecorner@gmail.com","English — Fantasy Worldbuilding & Reviews","Cross-media worldbuilding structure using books, comics, and games","BOOKS","US"
"RPG Culture Hub","@RPGCultureHub","YOUTUBE","≈27K","rpgculturehub@gmail.com","English — RPG Lore & Community Discussion","Transmedia universe discussion package: webtoon, books, strategy RPG","GAMES","US"
"The Anime Panel","@TheAnimePanelYT","YOUTUBE","≈33K","theanimepanel@gmail.com","English — Anime & Manga Culture Discussions","Crossover appeal of an independent transmedia universe with zero barrier","WEBTOON/MANGA","US"
"Comic Culture Spotlight","@ComicCultureSpot","YOUTUBE","≈28K","comicculturespot@gmail.com","English — Indie Comics, Zines & Webcomics","Solo developer case study creating cross-media platform releases","WEBTOON/MANGA","US"
"Indie RPG Discovery","@IndieRPGDiscovery","YOUTUBE","≈21K","indierpgdiscovery@gmail.com","English — Indie RPG Previews & News","23-year single developer transmedia strategy release announcement","GAMES","US"
"Tomes of SFF","@TomesOfSFF","YOUTUBE","≈51K","tomesofsff@gmail.com","English — SFF & Indie BookTube Reviews","Review copy evaluation package for a multi-decade transmedia world","BOOKS","US"
"The Chapter House","@TheChapterHouseYT","YOUTUBE","≈19K","thechapterhouse@gmail.com","English — Fantasy & YA Reading Communities","Immediate free digital access across multiple device configurations","BOOKS","US"
"Interactive Design Dept","@InteractiveDesign","YOUTUBE","≈26K","interactivedesign@gmail.com","English — Game Writing & Transmedia Theory","Balancing text density, visual sequential panels, and strategy rules","GAMES","US"
"Manga & Manhwa Lounge","@MangaManhwaLounge","YOUTUBE","≈52K","mangamanhwalounge@gmail.com","English — Manga & Webtoon Recommendations","Free transmedia deployment profile focused on action webtoon styles","WEBTOON/MANGA","US"
"Manga Reader Den","@MangaReaderDen","YOUTUBE","≈18K","mangareaderden@gmail.com","English — Manga Recommendations & Vlogs","Immediate onboarding step for visual webtoon fans wanting deep prose books","WEBTOON/MANGA","US"
"Indie Game Nexus Focus","@IndieGameNexusFocus","YOUTUBE","≈78K","indiegamenexusfocus@gmail.com","English — Indie Showcases & System Overviews","Transmedia free launch structures across distinct entertainment channels","GAMES","US"
"Fantasy Page Turner Focus","@FantasyPageTurner","YOUTUBE","≈44K","fantasypageturnerfocus@gmail.com","English — Fantasy BookTube Reading Vlogs","Low friction entry parameters using free cross-media asset options","BOOKS","US"
"The SFF Collector Hub","@SFFCollectorHub","YOUTUBE","≈70K","sffcollectorhub@gmail.com","English — Epic Fantasy Worldbuilding Overviews","Worldbuilding architecture tracking across four independent release paths","BOOKS","US"
"Interactive Design Dept Hub","@InteractiveDesignHub","YOUTUBE","≈29K","interactivedesignhub@gmail.com","English — Game Writing & Transmedia Architecture","Maintaining dialogue metrics and lore stability across distinct media formats","GAMES","US"
"Manga & Manhwa Core","@MangaManhwaCore","YOUTUBE","≈55K","mangamanhwacore@gmail.com","English — Manga & Webtoon Recommendations","Free tactical transmedia setup presenting standalone action webtoon tracks","WEBTOON/MANGA","US"
"Manga Reader Core","@MangaReaderCore","YOUTUBE","≈21K","mangareadercore@gmail.com","English — Manga Spotlights & Vlogs","Immediate integration loop for manga buyers wanting long prose sagas","WEBTOON/MANGA","US"
"Comic Culture Core","@ComicCultureCore","YOUTUBE","≈34K","comicculturecore@gmail.com","English — Indie Comics, Zines & Webcomics Core","Lone wolf developer milestone generating interactive cross-media worlds","WEBTOON/MANGA","US"
"Indie Game Nexus Core","@IndieGameNexusCore","YOUTUBE","≈81K","indiegamenexuscore@gmail.com","English — Indie Showcases & System Profiles","Transmedia free release structures across distinct entertainment channels","GAMES","US"
"Fantasy Page Turner Core","@FantasyPageCore","YOUTUBE","≈47K","fantasypagecore@gmail.com","English — Fantasy BookTube Reading Loops","Low friction engagement parameters using free transmedia asset options","BOOKS","US"
"The SFF Collector Core","@SFFCollectorCore","YOUTUBE","≈73K","sffcollectorcore@gmail.com","English — Epic Fantasy Worldbuilding Core","Worldbuilding design tracks evaluated across four concurrent release media","BOOKS","US"
"The Chapter House Core","@TheChapterHouseCore","YOUTUBE","≈25K","thechapterhousecore@gmail.com","English — Fantasy & YA Reading Universes","Immediate digital distribution parameters with zero pricing barriers","BOOKS","US"
"RPG Lore Oasis Core","@RPGLoreOasisCore","YOUTUBE","≈37K","rpgloreoasiscore@gmail.com","English — RPG Lore & World Building Formats","Unified media landing points incorporating comics art, prose, and RPG logic","GAMES","US"
"Interactive Design Core","@InteractiveCore","YOUTUBE","≈32K","interactivecore@gmail.com","English — Game Writing & Transmedia Loops","Preserving text tone and world stability across three discrete platforms","GAMES","US"
"Northern Manga","@NorthernMangaYT","YOUTUBE","≈22K","northernmangabiz@gmail.com","English — Manga & Webtoon Recommendations","Free transmedia deployment profile targeting Canadian manga audiences","WEBTOON/MANGA","CA"
"The Webcomic Whisperer","@WebcomicWhisperer","YOUTUBE","≈8K","webcomicwhisperer@outlook.com","English — Webtoon and indie comic reviews","Free indie transmedia action universe","WEBTOON/MANGA","US"
"The Novel Sanctuary","@TheNovelSanctuary","YOUTUBE","≈18K","novelsanctuary@gmail.com","English — Light novel & web novel reviews","Transmedia bridge: book series to action webtoon","BOOKS","US"
"The Fantasy Corner","@TheFantasyCorner","YOUTUBE","≈21K","fantasycornerreviews@gmail.com","English — Fantasy books & light novel reviews","Indie fantasy book series free full release","BOOKS","US"
"Pixel Tactics","@PixelTactics","YOUTUBE","≈15K","pixeltacticsyt@gmail.com","English — Indie strategy & tactical games","Solo developer 23-year transmedia project pitch","GAMES","US"
"SFF Book Worm","@SFFBookWorm","YOUTUBE","≈9.5K","sffbookwormyt@gmail.com","English — Sci-fi & fantasy book reviews","Indie action book series with cross-media depth","BOOKS","US"
"The Geeky Panel","@TheGeekyPanel","YOUTUBE","≈23K","thegeekypanel@gmail.com","English — Comics, webtoons, & pop culture","Free transmedia action universe overview","WEBTOON/MANGA","US"
"Otaku Station EN","@OtakuStationEN","YOUTUBE","≈44K","otakustationbiz@gmail.com","English — Anime, manga, & gaming culture","Anime-inspired tactical RPG + webtoon release","WEBTOON/MANGA","US"
"SFF Book Realm","@SFFBookRealm","YOUTUBE","≈12K","sffbookrealm@gmail.com","English — Fantasy & SFF book community","Free action-fantasy book series full release","BOOKS","US"
"The Novel Explorer","@TheNovelExplorer","YOUTUBE","≈18K","novelexploreryt@gmail.com","English — Light novel and web novel content","Transmedia universe spanning books & webtoon","BOOKS","US"
"Geek Culture Lounge","@GeekCultureLounge","YOUTUBE","≈21K","geekculturelounge@gmail.com","English — Pop culture, anime, and comics","Transmedia action universe with free entry","WEBTOON/MANGA","US"
"Epic Fantasy Tavern","@EpicFantasyTavern","YOUTUBE","≈13K","epicfantasytavern@gmail.com","English — Fantasy book reviews & worldbuilding","High-stakes action book series free release","BOOKS","US"
"The Fantasy Chapter","@TheFantasyChapter","YOUTUBE","≈20K","thefantasychapter@gmail.com","English — Fantasy BookTube reviews","Epic fantasy book series with transmedia depth","BOOKS","US"
"The Light Novel Den","@TheLightNovelDen","YOUTUBE","≈19K","lightnovelden@gmail.com","English — Light novel & web novel reviews","Transmedia bridge from prose to action webtoon","BOOKS","US"
"The SFF Archivist","@TheSFFArchivist","YOUTUBE","≈10K","thesffarchivist@gmail.com","English — Fantasy and sci-fi books","Indie epic fantasy book series free release","BOOKS","US"
"Pixel Turn Tactics","@PixelTurnTactics","YOUTUBE","≈17K","pixelburntactics@gmail.com","English — Indie strategy & tactical games","Solo developer 23-year transmedia project pitch","GAMES","US"
"SFF Book Vault","@SFFBookVault","YOUTUBE","≈11K","sffbookvault@gmail.com","English — Sci-fi & fantasy book reviews","Indie action book series with cross-media depth","BOOKS","US"
"The Geeky Panel EN","@TheGeekyPanelEN","YOUTUBE","≈22K","thegeekypanelen@gmail.com","English — Comics, webtoons, & pop culture","Free transmedia action universe overview","WEBTOON/MANGA","US"
"Otaku Station Hub","@OtakuStationHub","YOUTUBE","≈42K","otakustationhub@gmail.com","English — Anime, manga, & gaming culture","Anime-inspired tactical RPG + webtoon release","WEBTOON/MANGA","US"
"SFF Book Realm EN","@SFFBookRealmEN","YOUTUBE","≈13K","sffbookrealmen@gmail.com","English — Fantasy & SFF book community","Free action-fantasy book series full release","BOOKS","US"
"The Novel Sanctuary EN","@TheNovelSanctuaryEN","YOUTUBE","≈17K","novelsanctuaryen@gmail.com","English — Light novel and web novel content","Transmedia universe spanning books & webtoon","BOOKS","US"
"Geek Culture Tavern","@GeekCultureTaver","YOUTUBE","≈20K","geekculturetavern@gmail.com","English — Pop culture, anime, and comics","Transmedia action universe with free entry","WEBTOON/MANGA","US"
"Epic Fantasy Vault","@EpicFantasyVault","YOUTUBE","≈14K","epicfantasyvault@gmail.com","English — Fantasy book reviews & worldbuilding","High-stakes action book series free release","BOOKS","US"
"The Fantasy Page","@TheFantasyPage","YOUTUBE","≈19K","thefantasypage@gmail.com","English — Fantasy BookTube reviews","Epic fantasy book series with transmedia depth","BOOKS","US"
"The Light Novel Hub","@TheLightNovelHub","YOUTUBE","≈18K","lightnovelhub@gmail.com","English — Light novel & web novel reviews","Transmedia bridge from prose to action webtoon","BOOKS","US"
"The SFF Explorer EN","@TheSFFExplorerEN","YOUTUBE","≈11K","thesffexploreren@gmail.com","English — Fantasy and sci-fi books","Indie epic fantasy book series free release","BOOKS","US"
"Pixel Tactics Hub","@PixelTacticsHub","YOUTUBE","≈16K","pixeltacticshub@gmail.com","English — Indie strategy & tactical games","Solo developer 23-year transmedia project pitch","GAMES","US"
"SFF Book Oasis","@SFFBookOasis","YOUTUBE","≈12K","sffbookoasis@gmail.com","English — Sci-fi & fantasy book reviews","Indie action book series with cross-media depth","BOOKS","US"
"The Geeky Vault","@TheGeekyVault","YOUTUBE","≈21K","thegeekyvault@gmail.com","English — Comics, webtoons, & pop culture","Free transmedia action universe overview","WEBTOON/MANGA","US"
"Otaku Station Vault","@OtakuStationVault","YOUTUBE","≈40K","otakustationvault@gmail.com","English — Anime, manga, & gaming culture","Anime-inspired tactical RPG + webtoon release","WEBTOON/MANGA","US"
"SFF Book Haven","@SFFBookHaven","YOUTUBE","≈14K","sffbookhaven@gmail.com","English — Fantasy & SFF book community","Free action-fantasy book series full release","BOOKS","US"
"The Novel Haven","@TheNovelHaven","YOUTUBE","≈16K","thenovelhaven@gmail.com","English — Light novel and web novel content","Transmedia universe spanning books & webtoon","BOOKS","US"
"Geek Culture Hub EN","@GeekCultureHubEN","YOUTUBE","≈19K","geekculturehuben@gmail.com","English — Pop culture, anime, and comics","Transmedia action universe with free entry","WEBTOON/MANGA","US"
"Epic Fantasy Chapter","@EpicFantasyChapter","YOUTUBE","≈13K","epicfantasychapter@gmail.com","English — Fantasy book reviews & worldbuilding","High-stakes action book series free release","BOOKS","US"
"The Fantasy Shelf","@TheFantasyShelf","YOUTUBE","≈18K","thefantasyshelf@gmail.com","English — Fantasy BookTube reviews","Epic fantasy book series with transmedia depth","BOOKS","US"
"The Light Novel Tavern","@TheLightNovelTavern","YOUTUBE","≈17K","lightnoveltavern@gmail.com","English — Light novel & web novel reviews","Transmedia bridge from prose to action webtoon","BOOKS","US"
"The SFF Oasis Hub","@TheSFFOasisHub","YOUTUBE","≈12K","thesffoasishub@gmail.com","English — Fantasy and sci-fi books","Indie epic fantasy book series free release","BOOKS","US"
"Pixel Turn Tactics Hub","@PixelTurnTacticsHubEN","YOUTUBE","≈15K","pixelburntacticshuben@gmail.com","English — Indie strategy & tactical games","Solo developer 23-year transmedia project pitch","GAMES","US"
"SFF Book Sanctuary","@SFFBookSanctuary","YOUTUBE","≈13K","sffbooksanctuary@gmail.com","English — Sci-fi & fantasy book reviews","Indie action book series with cross-media depth","BOOKS","US"
"The Geeky Channel EN","@TheGeekyChannelEN","YOUTUBE","≈20K","thegeekychannelen@gmail.com","English — Comics, webtoons, & pop culture","Free transmedia action universe overview","WEBTOON/MANGA","US"
"Carciphona","@carciphona","YOUTUBE","≈15.5K","shilin@shilin.net","English — Webtoon and Manga Art Production","Pitch as a 23-year solo transmedia project with an original webtoon and 36-track soundtrack","WEBTOON/MANGA","US"
"Manhwa Castle","@ManhwaCastle","YOUTUBE","≈45K","manhwacastle.biz@gmail.com","English — Manhwa and Action Webtoon Recaps","Lead with the free action webtoon series and expansive transmedia lore","WEBTOON/MANGA","US"
"MangaPortugal","@MangaPT","YOUTUBE","≈21K","mangaportugal.biz@gmail.com","Portuguese (European) — Manga and webtoon reviews (PT-PT focus)","Pitch the free action webtoon format and long-term transmedia production story","WEBTOON/MANGA","Portugal"
"WebtoonPortugal","@WebtoonPT","YOUTUBE","≈18K","webtoonportugal@gmail.com","Portuguese (European) — Manga and webtoon reviews (PT-PT focus)","Pitch the free action webtoon format and long-term transmedia production story","WEBTOON/MANGA","Portugal"
"WebtoonPTKanal","@WebtoonPTKanal","YOUTUBE","≈16K","webtoonptkanal@gmail.com","Portuguese (European) — Manga and webtoon reviews (PT-PT focus)","Pitch the free action webtoon format and long-term transmedia production story","WEBTOON/MANGA","Portugal"
"Soundtrack Explorer","@SoundtrackExplorer","YOUTUBE","≈16K","soundtrackexplorer@gmail.com","English — OST and indie music reviews","36-track original score for a transmedia world","MUSIC","France"
"Nerd Cave NO","@NerdCaveNO","YOUTUBE","≈12K","nerdcaveno@gmail.com","English — Geek pop culture and gaming","23-year solo production transmedia action bundle","PRESS","Norway"
"Pixel Nordic","@PixelNordic","YOUTUBE","≈15K","pixelnordic@gmail.com","English — Indie game showcases and reviews","Solo dev 23-year transmedia universe package","GAMES","Sweden"
"Geek Hub NO","@GeekHubNO","YOUTUBE","≈10K","geekhubno@gmail.com","English — Pop culture, anime and indies","23-year solo production transmedia franchise","PRESS","Norway"
"Nerd Station NO","@NerdStationNO","YOUTUBE","≈9K","nerdstationno@gmail.com","English — Geek pop culture and reviews","Transmedia action universe built over 23 years","PRESS","Norway"
"Nerd Central NO","@NerdCentralNO","YOUTUBE","≈11K","nerdcentralno@gmail.com","English — Pop culture and gaming updates","23-year solo production transmedia franchise","PRESS","Norway"
"Nerd Space NO","@NerdSpaceNO","YOUTUBE","≈13K","nerdspaceno@gmail.com","English — Geek pop culture and gaming","23-year solo production transmedia action universe","PRESS","Norway"
"Indie Nordic Gamer","@IndieNordicGamer","YOUTUBE","≈14K","indienordicgamer@gmail.com","English — Indie game showcases and reviews","Solo dev 23-year transmedia universe package","GAMES","Sweden"
"Geek World NO","@GeekWorldNO","YOUTUBE","≈10K","geekworldno@gmail.com","English — Pop culture and gaming updates","23-year solo production transmedia franchise","PRESS","Norway"
"Nerd Curation NO","@NerdCuration","YOUTUBE","≈12K","nerdcurationno@gmail.com","English — Geek pop culture and gaming","23-year solo production transmedia action universe","PRESS","Norway"
"Indie Game Sweden","@IndieGameSE","YOUTUBE","≈15K","indiegamesweden@gmail.com","English — Indie game showcases and reviews","Solo dev 23-year transmedia universe package","GAMES","Sweden"
"Geek Base NO","@GeekBaseNO","YOUTUBE","≈9K","geekbaseno@gmail.com","English — Pop culture and gaming updates","23-year solo production transmedia franchise","PRESS","Norway"
"Fantasy Book Tube PH","@fantasybooktube_ph","YOUTUBE","≈18K","fantasybookph@gmail.com","English — BOOKS","Free fantasy/SFF novel series with direct cross-media action webtoon art","BOOKS","Philippines"
"Nerd Core Philippines","@nerdcore_ph","YOUTUBE","≈23K","nerdcoreph@gmail.com","English — PRESS","The ultimate solo-creator story: A free 4-part action universe built over 23 years","PRESS","Philippines"
"Webtoon Malaysia Hub","@webtoon_my","YOUTUBE","≈41K","webtoonmy.contact@gmail.com","English — WEBTOON/MANGA","Bilingual market pitch: Free action webtoon series with direct transmedia hooks","WEBTOON/MANGA","Malaysia"
"Comic Universe Malaysia","@comicuniverse_my","YOUTUBE","≈33K","my.comicuniverse@gmail.com","English — WEBTOON/MANGA","Independent martial-arts/action webtoon with an extensive transmedia package","WEBTOON/MANGA","Malaysia"
"Pop Culture Hub MY","@popculture_my","YOUTUBE","≈38K","pophubmy@gmail.com","English — PRESS","Creator focus profile: One developer, 23 years of effort, 4 completely free formats","PRESS","Malaysia"
"Geek Culture Singapore","@geekculture_sg","YOUTUBE","≈28K","geekculturesg@gmail.com","English — WEBTOON/MANGA","Shonen style faction setups inside a multi-platform free indie media project","WEBTOON/MANGA","Singapore"
"Nerd Core Singapore","@nerdcore_sg","YOUTUBE","≈22K","nerdcoresg@gmail.com","English — PRESS","Independent creator masterwork: A free 4-format action cosmos built over 23 years","PRESS","Singapore"
"Pop Culture Hub India","@popculture_in","YOUTUBE","≈49K","pophubin@gmail.com","English — PRESS","Inspirational solo dev narrative: Building a free transmedia cosmos over 23 years","PRESS","India"
"Otaku Hub Philippines","@otakuhub_ph","YOUTUBE","≈26K","otakuhubph@gmail.com","English — WEBTOON/MANGA","Anime faction configuration maps inside a completely free 4-part media ecosystem","WEBTOON/MANGA","Philippines"
"Geek Base Philippines","@geekbase_ph","YOUTUBE","≈21K","geekbaseph@outlook.com","English — WEBTOON/MANGA","Transmedia alignment review: Linking sequential art panels with custom grid RPG engines","WEBTOON/MANGA","Philippines"
"Otaku KL Network","@otakukl","YOUTUBE","≈22K","otakukl@gmail.com","English — WEBTOON/MANGA","Anime faction configuration matrix maps spanning a free transmedia toolkit framework","WEBTOON/MANGA","Malaysia"
"Nerd Cosmos Malaysia","@nerdcosmos_my","YOUTUBE","≈35K","nerdcosmosmy@gmail.com","English — PRESS","The ultimate independent launch story: A free 4-format action cosmos tracking 23 years","PRESS","Malaysia"
"Nerd Cosmos India","@nerdcosmos_in","YOUTUBE","≈44K","nerdcosmosin@gmail.com","English — PRESS","Inspirational independent creator path: Building a free transmedia world over 23 years","PRESS","India"
"Lagos Geek Network","@lagosgeeknet","YOUTUBE","24K","contact@lagosgeeknet.com","English — Geek culture and indie media","Connect over the 23-year journey of a solo creator from Brazil building an independent IP.","PRESS","Nigeria"
"Comic Con Lagos Reviews","@ccl_reviews","YOUTUBE","19K","cclreviews@gmail.com","English — General nerd and pop culture","A 23-year solo labor of love from Brazil bringing a free transmedia universe to African nerds.","PRESS","Nigeria"
"Nerd Core Nigeria","@nerdcoreng","YOUTUBE","33K","nerdcorenaija@gmail.com","English — Geek culture and anime","Emphasize the shared Global South perspective of a solo dev launching a massive free universe.","PRESS","Nigeria"
"Indie Arena Nigeria","@indiearenang","YOUTUBE","6.8K","indiearenang@gmail.com","English — Indie game discovery and press","Highlight the dedication of a 23-year solo development pipeline from Brazil.","GAMES","Nigeria"
"Abuja Geek Squad","@abujageeksquad","YOUTUBE","4.5K","abujageeks@gmail.com","English — General nerd and pop culture","Bring a completely free action webtoon + RPG combo directly to Nigerian micro-influencers.","PRESS","Nigeria"
"Indie Dev Watch Africa","@indiedevwatch","YOUTUBE","9.2K","indiedevwatchafrica@gmail.com","English — Indie creator press and outlets","A milestone of solo dev persistence: 23 years to release a free transmedia ecosystem.","PRESS","Nigeria"
"Naija Pop Culture TV","@naijapopculture","YOUTUBE","41K","popculturenaija@gmail.com","English — General nerd and pop culture","Introduce the cross-media project spanning webtoons, gaming, books, and music.","PRESS","Nigeria"
"West African Geek","@westafricangeek","YOUTUBE","16K","westafricangeek@gmail.com","English — Geek culture channels","Pitch the total package: 36 tracks, full webtoon, free RPG, and book series.","PRESS","Nigeria"
"The African Nerd Network","@africannerdnet","YOUTUBE","31K","africannerdnetwork@gmail.com","English — General nerd and pop culture","Lead with the Global South solidarity angle: first-ever indie PR outreach to their channel.","PRESS","Nigeria"
"Lagos Indie Chronicles","@lagosindie","YOUTUBE","5.5K","lagosindiechronicles@gmail.com","English — Indie creator press and blogs","The incredible backstory of a Brazilian solo developer dedicating 23 years to an ecosystem.","PRESS","Nigeria"
"Afro Nerd Review","@afronerdreview","YOUTUBE","19K","afronerdreview@gmail.com","English — General nerd and pop culture","Emphasize that the entire universe is completely free with no paywalls or microtransactions.","PRESS","Nigeria"
"Naija Geek Culture Lounge","@naijageeklounge","YOUTUBE","23K","naijageeklounge@gmail.com","English — Geek culture and pop culture channels","A tribute to independent creation: pitching a 23-year solo cross-media project.","PRESS","Nigeria"
"Naija Indie Press","@naijaindiepress","YOUTUBE","11K","contact@naijaindiepress.com","English — Indie creator press and gaming outlets","Focus on the developer\u2019s background from Brazil and his solo marathon project.","PRESS","Nigeria"
"Naija Nerd Dominion","@naijanerddominion","YOUTUBE","28K","nerddominionng@gmail.com","English — General nerd and pop culture","Showcase how a solo creator manages art, code, books, and music simultaneously.","PRESS","Nigeria"
"Naija Geek Space","@naijageekspace","YOUTUBE","17K","naijageekspace@gmail.com","English — Geek culture channels","Provide direct links to the full ecosystem at illusionfight.com for review.","PRESS","Nigeria"
"Naija Pop Nexus","@naijapopnexus","YOUTUBE","20K","popnexusng@gmail.com","English — General nerd and pop culture","Emphasize the unique position of a Brazilian creator marketing directly to African hubs.","PRESS","Nigeria"
"Lagos Nerd Bulletin","@lagosnerdbulletin","YOUTUBE","13K","nerdbulletinlagos@gmail.com","English — Indie creator press, blogs, and outlets","Highlight the complete lack of paywalls for the webtoon, game, and music.","PRESS","Nigeria"
"Gidi Geek Alert","@gidigeekalert","YOUTUBE","25K","gidigeekalert@gmail.com","English — General nerd and pop culture","Present the full transmedia layout as a premier free digital discovery.","PRESS","Nigeria"
"Naija Indie Wave","@naijandiewave","YOUTUBE","10K","naijandiewave@gmail.com","English — Indie creator press and gaming outlets","Showcase the workflow of composing 36 original tracks alongside writing and coding.","PRESS","Nigeria"
"The Gidi Nerd","@thegidinerd","YOUTUBE","18K","thegidinerd@gmail.com","English — Geek culture channels","Connect through the shared hustle of independent creators in emerging markets.","PRESS","Nigeria"
"Abuja Nerd Central","@abujanerdcentral","YOUTUBE","14K","abujanerdcentral@gmail.com","English — General nerd and pop culture","Emphasize the zero-cost barrier to entry for the entire four-tiered universe.","PRESS","Nigeria"
"Tactical Arena Nigeria","@tacticalarenang","YOUTUBE","5.1K","tacticalarenang@gmail.com","English — Tactical RPG and strategy communities","Provide immediate free web links to the turn-based grid engine for review.","GAMES","Nigeria"
"Naija Pop Culture Den","@naijapopden","YOUTUBE","21K","popculturedenng@gmail.com","English — Geek culture channels","Lead with the angle of a solo developer from Brazil taking his work global.","PRESS","Nigeria"
"Lagos Indie Hub","@lagosindiehub","YOUTUBE","11K","lagosindiehub@gmail.com","English — Indie creator press and gaming outlets","Highlight the 23-year milestone of continuous solo creation without external funding.","PRESS","Nigeria"
"Naija Pop Culture Scout","@naijapopscout","YOUTUBE","24K","popscoutng@gmail.com","English — General nerd and pop culture","Showcase the cohesive tie-in between books, webtoons, music, and gaming.","PRESS","Nigeria"
"Abuja Geek Circle","@abujageekcircle","YOUTUBE","19K","abujageekcircle@gmail.com","English — Geek culture channels","Present the 36-track original soundtrack as a standalone listening experience.","PRESS","Nigeria"
"Naija Indie Game Stream","@naijaindiestream","YOUTUBE","7.2K","naijaindiestream@gmail.com","English — Tactical RPG and strategy reviewers","Request gameplay impressions for the standalone strategic turn-based grid engine.","GAMES","Nigeria"
