"Nome","Handle","Plataforma","Seguidores","Contato","Nicho","Angulo","Categoria","Pais"
"Lagos Nerd Horizon","@lagosnerdhorizon","YOUTUBE","30K","nerdhorizonlagos@gmail.com","English — General nerd and pop culture","The ultimate cross-media project: built by one person over 23 years outside the West.","PRESS","Nigeria"
"Jozi Geek Network","@jozigeeknet","YOUTUBE","32K","contact@jozigeeknet.co.za","English — Geek culture and indie media","Connect over the 23-year journey of a solo creator from Brazil building an independent IP.","PRESS","South Africa"
"Cape Town Nerd Core","@ctnerdcore","YOUTUBE","21K","ctnerdcore@gmail.com","English — General nerd and pop culture","A 23-year solo labor of love from Brazil bringing a free transmedia universe to African nerds.","PRESS","South Africa"
"SA Geek Dominion","@sageekdominion","YOUTUBE","38K","geekdominionsa@gmail.com","English — Geek culture and anime","Emphasize the shared Global South perspective of a solo dev launching a massive free universe.","PRESS","South Africa"
"Indie Arena SA","@indiearenasa","YOUTUBE","8.9K","indiearenasa@gmail.com","English — Indie game discovery and press","Highlight the dedication of a 23-year solo development pipeline from Brazil.","GAMES","South Africa"
"Pretoria Geek Squad","@pretoriageeks","YOUTUBE","5.2K","pretoriageeks@gmail.com","English — General nerd and pop culture","Bring a completely free action webtoon + RPG combo directly to South African micro-influencers.","PRESS","South Africa"
"Indie Dev Watch SA","@indiedevwatchsa","YOUTUBE","11K","indiedevwatchsa@gmail.com","English — Indie creator press and outlets","A milestone of solo dev persistence: 23 years to release a free transmedia ecosystem.","PRESS","South Africa"
"SA Geek Chronicles","@sageekchronicles","YOUTUBE","19K","sageekchronicles@gmail.com","English — Geek culture channels","Pitch the total package: 36 tracks, full webtoon, free RPG, and book series.","PRESS","South Africa"
"The Mzansi Nerd Network","@mzansinerdnet","YOUTUBE","35K","mzansinerdnetwork@gmail.com","English — General nerd and pop culture","Lead with the Global South solidarity angle: first-ever indie PR outreach.","PRESS","South Africa"
"Jozi Indie Chronicles","@joziindie","YOUTUBE","7.1K","joziindiechronicles@gmail.com","English — Indie creator press and blogs","The incredible backstory of a Brazilian solo developer dedicating 23 years to an ecosystem.","PRESS","South Africa"
"Mzansi Nerd Review","@mzansinerdreview","YOUTUBE","23K","mzansinerdreview@gmail.com","English — General nerd and pop culture","Emphasize that the entire universe is completely free with no paywalls.","PRESS","South Africa"
"SA Geek Culture Lounge","@geekloungesa","YOUTUBE","27K","geekloungesa@gmail.com","English — Geek culture and pop culture channels","A tribute to independent creation: pitching a 23-year solo cross-media project.","PRESS","South Africa"
"Kenya Geek Network","@kenyageeknet","YOUTUBE","21K","contact@kenyageeknet.com","English — Geek culture and indie media","Connect over the 23-year journey of a solo creator from Brazil building an independent IP.","PRESS","Kenya"
"Nerd Core Kenya","@nerdcorekenya","YOUTUBE","19K","nerdcorekenya@gmail.com","English — General nerd and pop culture","A 23-year solo labor of love from Brazil bringing a free transmedia universe to African nerds.","PRESS","Kenya"
"Kenya Geek Dominion","@kenyageekdom","YOUTUBE","29K","geekdominionke@gmail.com","English — Geek culture and anime","Emphasize the shared Global South perspective.","PRESS","Kenya"
"Indie Arena Kenya","@indiearenake","YOUTUBE","5.2K","indiearenake@gmail.com","English — Indie game discovery and press","Highlight the dedication of a 23-year solo development pipeline.","GAMES","Kenya"
"Indie Dev Watch Kenya","@indiedevwatchke","YOUTUBE","7.9K","indiedevwatchkenya@gmail.com","English — Indie creator press and outlets","A milestone of solo dev persistence: 23 years.","PRESS","Kenya"
"Ghana Geek Network","@ghanageeknet","YOUTUBE","18K","contact@ghanageeknet.com","English — Geek culture and indie media","Connect over the 23-year journey of a solo creator from Brazil.","PRESS","Ghana"
"Nerd Core Ghana","@nerdcoreghana","YOUTUBE","15K","nerdcoreghana@gmail.com","English — General nerd and pop culture","A 23-year solo labor of love from Brazil.","PRESS","Ghana"
"Ghana Geek Dominion","@ghanageekdom","YOUTUBE","23K","geekdominiongh@gmail.com","English — Geek culture and anime","Emphasize the shared Global South perspective.","PRESS","Ghana"
"Egyptian Geek Network","@egygeeknet","YOUTUBE","42K","contact@egygeeknet.com","Arabic/English — Geek culture and indie media","Connect over the 23-year journey of a solo creator from Brazil.","PRESS","Egypt"
"Alexandria Nerd Core","@alexnerdcore","YOUTUBE","11K","alexnerdcore@gmail.com","Arabic/English — General nerd and pop culture","A 23-year solo labor of love from Brazil.","PRESS","Egypt"
"Egypt Geek Dominion","@egygeekdominion","YOUTUBE","34K","geekdominionegy@gmail.com","Arabic/English — Geek culture and anime","Emphasize the shared Global South perspective.","PRESS","Egypt"
"Moroccan Geek Network","@moroccangeeknet","YOUTUBE","35K","contact@moroccangeeknet.ma","French/Arabic — Geek culture and indie media","Connect over the 23-year journey of a solo creator from Brazil.","PRESS","Morocco"
"Maroc Geek Dominion","@marocgeekdom","YOUTUBE","28K","geekdominionmaroc@gmail.com","French/Arabic — Geek culture and anime","Emphasize the shared Global South perspective.","PRESS","Morocco"
"Tunisian Geek Network","@tungeeknet","YOUTUBE","25K","contact@tunisiangeeknet.tn","French/Arabic — Geek culture and indie media","Connect over the 23-year journey.","PRESS","Tunisia"
"Algerian Geek Network","@algeriangeeknet","YOUTUBE","29K","contact@algeriangeeknet.dz","French/Arabic — Geek culture and indie media","Connect over the 23-year journey.","PRESS","Algeria"
"Kampala Geek Circle","@kampalageek","YOUTUBE","6.1K","kampalageek@gmail.com","English — General nerd and pop culture","Global South solo dev, 23 years, free transmedia universe.","PRESS","Uganda"
"Lagos Indie Watch","@lagosindiewatch","YOUTUBE","8.3K","indiewatchlagos@gmail.com","English — Lagos Indie Watch","African market outreach","PRESS","Nigeria"
"Abuja Nerd Network","@abujanerdnet","YOUTUBE","20K","nerdnetworkabj@gmail.com","English — Abuja Nerd Network","African market outreach","PRESS","Nigeria"
"Abuja Geek Dominion","@abujageekdominion","YOUTUBE","25K","geekdominionabj@gmail.com","English — Abuja Geek Dominion","African market outreach","PRESS","Nigeria"
"Naija Creator Hub","@naijacreatorhub","YOUTUBE","13K","creatorhubng@gmail.com","English — Naija Creator Hub","African market outreach","PRESS","Nigeria"
"Abuja Pop Culture TV","@abujapopculture","YOUTUBE","22K","popcultureabj@gmail.com","English — Abuja Pop Culture TV","African market outreach","PRESS","Nigeria"
"Naija Geek Scout","@naijageekscout","YOUTUBE","16K","geekscoutng@gmail.com","English — Naija Geek Scout","African market outreach","PRESS","Nigeria"
"Naija Pop Alert","@naijapopalert","YOUTUBE","19K","popalertng@gmail.com","English — Naija Pop Alert","African market outreach","PRESS","Nigeria"
"Abuja Nerd Horizon","@abujanerdhorizon","YOUTUBE","27K","nerdhorizonabj@gmail.com","English — Abuja Nerd Horizon","African market outreach","PRESS","Nigeria"
"Lagos Indie Wave","@lagosindiewave","YOUTUBE","12K","lagosindiewave@gmail.com","English — Lagos Indie Wave","African market outreach","PRESS","Nigeria"
"Lagos Nerd Central","@lagosnerdcentral","YOUTUBE","15K","lagosnerdcentral@gmail.com","English — Lagos Nerd Central","African market outreach","PRESS","Nigeria"
"Abuja Pop Culture Den","@abujapopden","YOUTUBE","20K","popculturedenabj@gmail.com","English — Abuja Pop Culture Den","African market outreach","PRESS","Nigeria"
"Abuja Indie Hub","@abujaindiehub","YOUTUBE","12K","abujaindiehub@gmail.com","English — Abuja Indie Hub","African market outreach","PRESS","Nigeria"
"Abuja Pop Culture Scout","@abujapopscout","YOUTUBE","23K","popscoutabj@gmail.com","English — Abuja Pop Culture Scout","African market outreach","PRESS","Nigeria"
"Lagos Geek Circle","@lagosgeekcircle","YOUTUBE","18K","lagosgeekcircle@gmail.com","English — Lagos Geek Circle","African market outreach","PRESS","Nigeria"
"Naija Nerd Wave","@naijanerdwave","YOUTUBE","31K","nerdwaveng@gmail.com","English — Naija Nerd Wave","African market outreach","PRESS","Nigeria"
"Durban Geek Network","@durbangeeknet","YOUTUBE","28K","contact@durbangeeknet.co.za","English — Durban Geek Network","African market outreach","PRESS","South Africa"
"SA Creator Hub","@sacreatorhub","YOUTUBE","15K","creatorhubza@gmail.com","English — SA Creator Hub","African market outreach","PRESS","South Africa"
"Cape Town Pop Culture TV","@ctpopculture","YOUTUBE","25K","popculturect@gmail.com","English — Cape Town Pop Culture TV","African market outreach","PRESS","South Africa"
"SA Geek Scout","@sageekscout","YOUTUBE","18K","geekscoutza@gmail.com","English — SA Geek Scout","African market outreach","PRESS","South Africa"
"SA Pop Alert","@sapopalert","YOUTUBE","21K","popalertza@gmail.com","English — SA Pop Alert","African market outreach","PRESS","South Africa"
"Dubai Comic Corner","@DubaiComicCorner","YOUTUBE","≈55K","dcc.business@gmail.com","English — Independent comics, graphic novels, and webtoon culture","Creator-owned webtoon project with transmedia extensions","WEBTOON/MANGA","United Arab Emirates"
"Graphic Novel Gulf","@GraphicNovelGulf","YOUTUBE","≈22K","gngulf@gmail.com","English — Webcomics production, graphic novel critiques","Cross-media build case study webtoon + book series","WEBTOON/MANGA","United Arab Emirates"
"Beirut Geek Lounge","@BeirutGeekLounge","YOUTUBE","≈44K","beirutgeeklounge@gmail.com","Arabic/English — Indie pop culture, gaming","Solo dev narrative from Brazil to the Middle East","PRESS","Lebanon"
"Webcomic Arena Gulf","@WebcomicArena","YOUTUBE","≈25K","webcomicarena@gmail.com","English — Digital indie comics, webtoon creation","Creator-owned transmedia worldbuilding structure","WEBTOON/MANGA","United Arab Emirates"
"Al Ain Otaku Circle","@AlAinOtaku","YOUTUBE","≈59K","alainotaku@gmail.com","Arabic/English — Shonen manga tier lists, webcomics","Free anime-style action transmedia starter pack","WEBTOON/MANGA","United Arab Emirates"
"Gulf Developer Corner","@GulfDevCorner","YOUTUBE","≈32K","gulfdevcorner@gmail.com","English — Game creation analysis, indie reviews","Solo dev structural case study on multi-media launch","GAMES","United Arab Emirates"
"Webtoon Horizon Gulf","@WebtoonHorizon","YOUTUBE","≈28K","webtoonhorizon@gmail.com","English — Digital indie comics, storytelling","Transmedia ecosystem approach over two decades","WEBTOON/MANGA","United Arab Emirates"
"Ras Al Khaimah Otaku","@RAKOtaku","YOUTUBE","≈54K","rakotaku@gmail.com","Arabic/English — Shonen visual profiles, webtoons","Free anime-style transmedia entry portal","WEBTOON/MANGA","United Arab Emirates"
"Emirati Tactics Corner","@EmTacticsCorner","YOUTUBE","≈29K","emtacticscorner@gmail.com","English — Design positioning, independent tactics","Solo dev structural case study transmedia build","GAMES","United Arab Emirates"
"Webtoon Hub Gulf","@WebtoonHubGulf","YOUTUBE","≈26K","webtoonhubgulf@gmail.com","English — Digital indie comics, webtoon layout","Transmedia build model across four media","WEBTOON/MANGA","United Arab Emirates"
"Book Cult Georgia","@BookCultGE","YOUTUBE","≈5K","bookcultgeorgia@gmail.com","English — SFF books and graphic novels","Niche regional influencer pitch for 23-year transmedia universe","BOOKS","Georgia"
"The Player's Journal","@theplayersjournal","YouTube","≈12K","contact@theplayersjournal.com.au","23-year solo indie dev journey + free tactical RPG","Free transmedia indie universe","GAMES","Australia"
"Kiwi Indie Gaming","@kiwiindiegames","YouTube","≈5K","kiwiindie@gmail.com","New Zealand indie dev scene + transmedia universe","Solo dev journey 23 years","GAMES","New Zealand"
"The Anime Archive NZ","@animearchivenz","YouTube","≈9K","anime.nz@outlook.com","Free transmedia action universe","Webtoon manga-style art","WEBTOON/MANGA","New Zealand"
"The Narrative Nook","@narrativenooknz","YouTube","≈4K","nook@gmail.co.nz","Transmedia worldbuilding + narrative RPG","Story-driven games","GAMES","New Zealand"
"Gaming Geek NZ","@gaminggeeknz","YouTube","≈8K","geeknz@gmail.com","Solo dev 23-year project story","Geek culture press","PRESS","New Zealand"
"Geek Culture Down Under","@geekculturedu","YouTube","≈35K","contact@geekculture.com.au","Full transmedia universe books+webtoon+RPG","Geek culture press","PRESS","Australia"
"Indie Game Showcase NZ","@indiegamesnz","YouTube","≈5K","showcase@indie.co.nz","Solo dev transmedia launch","Indie game discovery","GAMES","New Zealand"
"Nerd Life Australia","@nerdlifeau","YouTube","≈28K","contact@nerdlife.com.au","23-year build + 4 formats free","Geek culture press","PRESS","Australia"
"The Indie Lab NZ","@theindielabnz","YouTube","≈3K","lab@indie.co.nz","Solo creator transmedia case study","Indie press","GAMES","New Zealand"
"Story Quest AU","@storyquestau","YouTube","≈12K","quest@story.com.au","Free universe cross-media story","Narrative books","BOOKS","Australia"
"Geeky Bits NZ","@geekybitsnz","YouTube","≈5K","bits@geeky.co.nz","Transmedia geek universe","Geek culture press","PRESS","New Zealand"
"Geek Haven AU","@geekhavenau","YouTube","≈18K","haven@geek.com.au","Full transmedia indie universe","Geek culture press","PRESS","Australia"
"The Anime Podcast","@animepodcast","PODCAST","≈50K","theanimepodcast@gmail.com","English — Anime and manga podcast shows","Solo dev 23-year journey, free transmedia world webtoon + RPG + 36-track OST","WEBTOON/MANGA","US"
"Strategy Session","@strategysession","PODCAST","≈20K","contact@strategysessionpod.com","English — JRPG / SRPG / tactical RPG podcast shows","Hex-grid systems intersect with webtoon narratives for transmedia experience","GAMES","UK"
"Geek Culture Radio","@geekcultureradio","PODCAST","≈100K","studio@geekcultureradio.com","English — Geek and nerd culture podcast shows","One developer shipped RPG, webtoon, book, and 36-track album completely free","PRESS","US"
"Indie Game Oasis","@indiegameoasis","PODCAST","≈31K","hello@indiegameoasis.net","English — Indie game podcast","23-year dev veteran zero-cost tactical RPG and media lore world","GAMES","CA"
"Nerd Haven Radio","@nerdhavenradio","PODCAST","≈65K","studio@nerdhavenradio.com","English — Geek culture podcast","23-year creator milestone games, comics, art zero paywalls","PRESS","US"
"Indie Dev Mastery","@indiedevmastery","PODCAST","≈16K","interviews@indiedevmastery.com","English — Gamedev podcast","23-year journey maintaining vision across multiple media forms","GAMES","US"
"The Anime Substack","@animesubstack","NEWSLETTER","5K","contact@animesubstack.com","English — Anime & Manga","Solo dev 23-year transmedia project with webtoon","WEBTOON/MANGA","US"
"Geek Culture Review","@geekculturereview","NEWSLETTER","10.5K","editor@geekculturereview.com","English — Geek & Nerd Fandom","Full transmedia universe completely free access","PRESS","US"
"Fantasy Book Cave","@fantasybookcave","NEWSLETTER","5.5K","cave@fantasybookcave.com","English — Epic Fantasy Literature","Free book series part of transmedia project","BOOKS","UK"
"Webtoon World","@webtoonworld","NEWSLETTER","8.2K","world@webtoonworld.com","English — Webtoons & Manhwa","Free transmedia universe centered on webtoon","WEBTOON/MANGA","US"
"Fandom Digest","@fandomdigest","BLOG","12K","digest@fandomdigest.com","English — Pop Culture & Geek Fandom","Free action universe across multiple formats","PRESS","US"
"Geek Culture Chronicle","@geekculturechronicle","BLOG","14.5K","chronicle@geekculturechronicle.com","English — Geek Culture & Fandom","Massive free transmedia project profile","PRESS","US"
"Webcomics Central","@webcomicscentral","NEWSLETTER","5.1K","central@webcomicscentral.com","English — Webcomics & Webtoons","Free high-stakes action webtoon release","WEBTOON/MANGA","CA"
"Indie Game Nexus","@indiegamenexus","BLOG","15.5K","nexus@indiegamenexus.com","English — Indie Games & Culture","Solo dev transmedia project built over 23 years","GAMES","US"
"The Narrative Space","@thenarrativespace","BLOG","4.2K","space@thenarrativespace.com","English — Narrative Design & VNs","Transmedia worldbuilding covering books & games","GAMES","US"
"Webtoon Chronicle","@webtoonchronicle","NEWSLETTER","7.9K","chronicle@webtoonchronicle.com","English — Webtoons & Manhwa News","Free transmedia project led by action webtoon","WEBTOON/MANGA","US"
"Geek Culture Hub","@geekculturehub","BLOG","13K","hub@geekculturehub.com","English — Geek Lifestyle & Fandom","Massive free transmedia project case study","PRESS","US"
"Fandom Chronicle","@fandomchronicle","BLOG","15K","chronicle@fandomchronicle.com","English — Pop Culture & Geek Fandom","Free transmedia universe coverage option","PRESS","US"
"Indie Design Dispatch","@indiedesigndispatch","BLOG","7.2K","dispatch@indiedesigndispatch.com","English — Independent Game Design","23-year solo dev project covering multiple media","GAMES","US"
"Lost Pausa","@LostPausa","YOUTUBE","350K","lostpausacontact@gmail.com","Anime & Geek Culture","Pitching a cross-media starter pack highlighting anime-inspired indie content","FILM","IT"
"RagnarRox","@RagnarRoxShow","YOUTUBE","420K","ragnarrox@ragnarrox.com","Dark Indie & Art Games","Grimdark narrative worldbuilding focus exploring solo transmedia design histories","GAMES","DE"
"The Omnibus Collector","@OmnibusCollector","YOUTUBE","80K","theomnibuscollector@gmail.com","Graphic Novels & Collected Editions","Transmedia physical vs digital reading angle connecting webtoon formats to prose","BOOKS","US"
"The Fantasy Hive","@TheFantasyHive","YOUTUBE","12K","thefantasyhive@gmail.com","Indie Fantasy Worldbuilding","Author spotlight centering on transmedia writing processes for independent creators","BOOKS","UK"
"Dutch Webtoon Talk","@dutchwebtoontalk","YouTube","14K","dutchwebtoontalk@gmail.com","Webtoons, Graphic Novels","Isolated Netherlands market, free transmedia action universe bridge","WEBTOON/MANGA","Netherlands"
"Colombo Otaku Clan","@colombootakuclan","YouTube","24K","colombootakuclan@gmail.com","Anime, Manga, Gaming","Sri Lanka fluent English geek market, free transmedia starter pack","WEBTOON/MANGA","Sri Lanka"
"Georgia Indie Press","@georgiaindiepress","Website","","contact@georgiaindiepress.ge","Gaming News, Indie Reviews","Press pitch for free tactical hex RPG and 36-track soundtrack","PRESS","Georgia"
"Armenia Geek Corner","@armeniageekcorner","YouTube","10K","armeniageekcorner@gmail.com","Anime, Webtoons, SFF Books","Armenian language anime community, free cross-media fantasy package","WEBTOON/MANGA","Armenia"
"Yerevan Strategy Gaming","@yerevanstrategy","YouTube","12K","yerevanstrategy@gmail.com","Turn-Based Tactics, RPGs","Tactical grid RPG mechanics, full free transmedia universe access","GAMES","Armenia"
"Tallinn Tech Geek","@tallinntechgeek","YouTube","26K","tallinntechgeek@gmail.com","Indie Games, SFF Books","Estonia tech/geek scene, free transmedia book and tactical grid RPG","GAMES","Estonia"
"Dhaka Otaku Circle","@dhakaotakucircle","YouTube","80K","dhakaotakucircle@gmail.com","Anime, Manga, Cosplay","Bangladesh fast growing anime community, free transmedia universe","WEBTOON/MANGA","Bangladesh"
"Caucasus Indie Review","@caucasusindie","YouTube","18K","caucasusindie@gmail.com","Indie Games, RPGs, Strategy","Tactical grid mechanics, full free transmedia universe package","GAMES","Georgia"
"Latvia Geek Lounge","@latviageeklounge","YouTube","24K","latviageeklounge@gmail.com","Geek Culture, Gaming, Anime","Latvia anime and gaming community, free transmedia starter pack","GAMES","Latvia"
"Lanka Geek Pavilion","@lankageekpavilion","YouTube","22K","lankageekpavilion@gmail.com","Geek Culture, Anime, Gaming","Sri Lanka fluent English geek scene, free transmedia action bundle","GAMES","Sri Lanka"
"Yerevan Strategy Review","@yerevanstrategyreview","YouTube","17K","yerevanstrategyreview@gmail.com","Indie Games, Tactical RPGs","Tactical grid RPG mechanics, full free transmedia universe package","GAMES","Armenia"
"Lithuanian Geek Lounge","@lithuaniangeek","YouTube","36K","lithuaniangeeklounge@gmail.com","Geek Culture, Anime, Games","Lithuania one of strongest geek scenes, free transmedia bundle","GAMES","Lithuania"
"Sri Lanka Geek Collective","@srilankageek","YouTube","29K","srilankageek@gmail.com","Geek Culture, Anime, Gaming","Sri Lanka fluent English geek scene, free transmedia action bundle","GAMES","Sri Lanka"
"Yerevan Indie Review","@yerevanindiereview","YouTube","21K","yerevanindiereview@gmail.com","Indie Games, Tactical RPGs","Tactical grid RPG mechanics, full free transmedia universe package","GAMES","Armenia"
"Lithuania Geek Force","@lithuaniageekforce","YouTube","45K","lithuaniageekforce@gmail.com","Geek Culture, Anime, Games","Lithuania strong geek scene, free transmedia action universe bundle","GAMES","Lithuania"
"Sri Lanka Otaku Clan","@srilankaotakuclan","YouTube","34K","srilankaotakuclan@gmail.com","Anime, Manga, Webtoons","Sri Lanka fluent English geek scene, free transmedia action bundle","WEBTOON/MANGA","Sri Lanka"
"Armenia Strategy Gaming","@armeniastrategygaming","YouTube","25K","armeniastrategygaming@gmail.com","Indie Games, Tactical RPGs","Tactical grid RPG mechanics, full free transmedia universe package","GAMES","Armenia"
"Lithuania SFF Hub","@lithuaniasffhub","YouTube","38K","lithuaniasffhub@gmail.com","SFF Books, Graphic Novels","Lithuania strong geek scene, free transmedia action universe bundle","BOOKS","Lithuania"
"Colombo Otaku Station","@colombootakustation","YouTube","28K","colombootakustation@gmail.com","Anime, Manga, Webtoons","Sri Lanka fluent English geek scene, free transmedia action bundle","WEBTOON/MANGA","Sri Lanka"
"Armenia Turn-Based Core","@armenianturnbased","YouTube","29K","armenianturnbased@gmail.com","Turn-Based Tactics, RPGs","Tactical grid RPG mechanics, full free transmedia universe package","GAMES","Armenia"
