CONTACT ID;EMAIL;sib_contact_owner;sib_next_task;LASTNAME;FIRSTNAME;_DETECTED_LANGUAGE;DOUBLE_OPT-IN;OPT_IN;CONTACT_TIMEZONE;EXT_ID;LINKEDIN;JOB_TITLE;WHATSAPP;LANDLINE_NUMBER;SMS;SEGMENTO3;COMPANY;SEGM_ENTO_2;SEGMENTO;PAIS;STATUS;CATEGORY;ANGULO;NICHO;SEGUIDORES;PLATFORM;HANDLE;NAME;ADDED_TIME;MODIFIED_TIME
272;contato@dadoshistorias.com;;;;;;;;;;;;;;;;Dados & Histórias;;;;PENDENTE;GAMES;Estamos criando conteúdo para Illusion Fight, um jogo de grid hexagonal. Gostaríamos de mostrar o sistema em uma live no seu canal.;TTRPG;≈5.100;YouTube;@dadoshistorias;Dados & Histórias;26-06-2026;28-06-2026
295;contato@portalrpg.com.br;;;;;;;;;;;;;;;;Portal RPG;;;;PENDENTE;GAMES;Pitchar Illusion Fight como universo gratuito com RPG tático, lore e narrativa original.;RPG de mesa, cultura RPG;≈10K-50K;Site / Redes sociais;@portalrpg;Portal RPG;26-06-2026;28-06-2026
343;mestrepedrok@gmail.com;;;;;;;;;;;;;;;;Mestre Pedrok;;;;PENDENTE;GAMES;Propor uso do universo Illusion Fight como cenário para one-shots e campanhas com sistema tático;RPG de mesa, conteúdo nerd, ação;≈100K;YouTube;@mestrepedrok;Mestre Pedrok;26-06-2026;28-06-2026
364;roladados@podcast.com;;;;;;;;;;;;;;;;Podcast Rola Dados;;;;PENDENTE;GAMES;Queremos convidar vocês para uma sessão especial de Illusion Fight, o RPG tático com universo em webtoon e livro. O jogo é todo gratuito em illusionfight.com.;RPG de Mesa;≈5.700;Spotify;@roladados;Podcast Rola Dados;26-06-2026;28-06-2026
3018;contato@nerddetabuleiro.com.br;;;;;;;;;;;;;;;;Nerd de Tabuleiro;;;;PENDENTE;GAMES;Traçar o paralelo entre o design de grid hexagonal do RPG digital e sistemas clássicos de mesa.;Português — Comunidades de RPG de mesa, actual play e RPG indie nacional;18K;YOUTUBE;@nerddetabuleiro;Nerd de Tabuleiro;28-06-2026;28-06-2026

